{
  "$schema": "https://json-schema.org/draft/2020-12/schema",
  "$id": "https://schemas.harness.invalid/config.sensors.schema.json",
  "title": "drogna simulated sensors configuration",
  "description": "Configuration for C-04, the simulated sensors. Where they sample, how often, what they publish and with what noise all arrive here, so the same image samples a different world at a different rate without a source change. The common sections are referenced from config.common.schema.json rather than restated. Unknown keys are rejected: a typo in a key is a startup failure, never a silent default. Three datastreams and no more — sound speed is derived at the point of use and is not published (ADR-0005).",
  "type": "object",
  "required": ["component", "clock", "seed", "broker", "logging", "sensors"],
  "additionalProperties": false,
  "properties": {
    "component": { "$ref": "https://schemas.harness.invalid/config.common.schema.json#/$defs/component" },
    "clock": { "$ref": "https://schemas.harness.invalid/config.common.schema.json#/$defs/clock" },
    "seed": { "$ref": "https://schemas.harness.invalid/config.common.schema.json#/$defs/seed" },
    "broker": { "$ref": "https://schemas.harness.invalid/config.common.schema.json#/$defs/broker" },
    "logging": { "$ref": "https://schemas.harness.invalid/config.common.schema.json#/$defs/logging" },
    "sensors": {
      "title": "The sampling platform and its instruments",
      "type": "object",
      "required": ["platform", "field", "sampling", "datastreams", "publication", "reconnect"],
      "additionalProperties": false,
      "properties": {
        "platform": {
          "title": "Sampling platform",
          "description": "The SensorThings Thing these sensors are mounted on. A coordinate and a sampler: it carries no history and nothing is carried between its positions.",
          "type": "object",
          "required": ["id", "name", "description"],
          "additionalProperties": false,
          "properties": {
            "id": {
              "type": "string",
              "pattern": "^[a-z0-9][a-z0-9_.-]*$",
              "description": "The Thing identifier, and the first segment of every topic these sensors publish on."
            },
            "name": { "type": "string", "description": "Short name for a reader." },
            "description": { "type": "string", "description": "One line saying what the platform is." }
          }
        },
        "field": {
          "title": "The world being sampled",
          "description": "Where the environment generator's ground-truth manifest is. The sensors evaluate the analytic form the manifest describes rather than reading the stored field file, so a sampled value is the truth at a point rather than the truth plus an interpolation.",
          "type": "object",
          "required": ["directory", "manifest_file"],
          "additionalProperties": false,
          "properties": {
            "directory": { "type": "string", "description": "Directory holding the generated field and its manifest." },
            "manifest_file": { "type": "string", "description": "File name of the ground-truth manifest within that directory." }
          }
        },
        "sampling": {
          "title": "Where and when to sample",
          "description": "The rate and the positions. The sampling pattern of a scenario — arrive cold, then loiter, revisiting at the local decorrelation timescale — belongs to the scenario and planner features; these sensors sample where and when they are told to.",
          "type": "object",
          "required": ["interval_seconds", "depths_m", "positions"],
          "additionalProperties": false,
          "properties": {
            "interval_seconds": {
              "type": "number",
              "exclusiveMinimum": 0,
              "description": "Simulation seconds between samples. Simulation time, not host time: under an accelerated clock the sensors publish faster in real terms, which is the point of compressing time."
            },
            "depths_m": {
              "type": "array",
              "items": { "type": "number", "minimum": 0 },
              "description": "The depths sampled at each position, in metres below the surface."
            },
            "positions": {
              "type": "array",
              "description": "The positions visited, in order and then repeated. A list of places a sample is taken, not a route anything travels.",
              "items": {
                "type": "object",
                "required": ["latitude", "longitude"],
                "additionalProperties": false,
                "properties": {
                  "latitude": { "type": "number", "minimum": -90, "maximum": 90 },
                  "longitude": { "type": "number", "minimum": -180, "maximum": 180 }
                }
              }
            },
            "maximum_samples": {
              "type": "integer",
              "minimum": 1,
              "description": "Stop after this many samples. Absent means run until the clock stops, which is what a scenario does; a fixed count is what a demonstration of a fixed length needs."
            }
          }
        },
        "datastreams": {
          "title": "The three datastreams",
          "description": "Exactly three: temperature, salinity and pressure. There is no sound-speed datastream and adding one would need ADR-0005 amended. The observed property of each is an enumeration this schema closes at three; that there are three entries and that they are distinct is checked by the component at startup, because the deployment's own configuration checker runs on the standard library alone and implements no cardinality keyword.",
          "type": "array",
          "items": { "$ref": "#/$defs/datastream" }
        },
        "publication": {
          "title": "How observations are published",
          "description": "The topic namespaces obs/ and ctl/ are conventions of the harness and are not configurable; what is configurable is the delivery guarantee.",
          "type": "object",
          "required": ["qos"],
          "additionalProperties": false,
          "properties": {
            "qos": {
              "type": "integer",
              "enum": [0, 1, 2],
              "description": "MQTT quality of service. Level 1, at-least-once, is the default: duplicate suppression rests on the deterministic observation identifier rather than on the broker. Level 2 is available if level 1 proves troublesome, and is this value and nothing else."
            },
            "retain": {
              "type": "boolean",
              "description": "Whether observations are retained by the broker. False for a stream of measurements; a retained observation would be delivered again to every new subscriber and would say a stale value is current."
            }
          }
        },
        "reconnect": {
          "title": "Reconnection backoff",
          "description": "What a sensor does when the broker is not there. It retries with bounded backoff driven by the simulation clock, publishes no heartbeat until it is connected, and is therefore correctly greyed out in the client rather than falsely lit.",
          "type": "object",
          "required": ["initial_seconds", "maximum_seconds"],
          "additionalProperties": false,
          "properties": {
            "initial_seconds": {
              "type": "number",
              "exclusiveMinimum": 0,
              "description": "First wait, in simulation seconds. The host clock is not consulted, here or anywhere else in this component but the heartbeat."
            },
            "maximum_seconds": {
              "type": "number",
              "exclusiveMinimum": 0,
              "description": "Ceiling on the wait, in simulation seconds. Bounded so a sensor keeps trying rather than backing off into silence."
            }
          }
        }
      }
    }
  },
  "$defs": {
    "datastream": {
      "title": "Datastream configuration",
      "description": "One series: the pairing of the platform, an instrument and an observed property with a unit, and the noise the instrument adds.",
      "type": "object",
      "required": [
        "id",
        "name",
        "description",
        "observed_property",
        "observation_type",
        "unit_of_measurement",
        "sensor",
        "noise"
      ],
      "additionalProperties": false,
      "properties": {
        "id": {
          "type": "string",
          "pattern": "^[a-z0-9][a-z0-9_.-]*$",
          "description": "The Datastream identifier, and the second segment of the topic."
        },
        "name": { "type": "string", "description": "Short name for a reader." },
        "description": { "type": "string", "description": "One line saying what the series is." },
        "observed_property": { "$ref": "#/$defs/observed_property" },
        "observation_type": {
          "type": "string",
          "description": "SensorThings observationType. Every series here is a measurement."
        },
        "unit_of_measurement": {
          "title": "Unit of measurement",
          "type": "object",
          "required": ["name", "symbol", "definition"],
          "additionalProperties": false,
          "properties": {
            "name": { "type": "string", "description": "The unit in words." },
            "symbol": { "type": "string", "description": "The unit's symbol." },
            "definition": { "type": "string", "description": "The unit as the coverage store spells it, so a stored observation and a forecast field compare without a conversion table." }
          }
        },
        "sensor": {
          "title": "The simulated instrument",
          "type": "object",
          "required": ["id", "name", "description", "encoding_type"],
          "additionalProperties": false,
          "properties": {
            "id": {
              "type": "string",
              "pattern": "^[a-z0-9][a-z0-9_.-]*$",
              "description": "The Sensor identifier."
            },
            "name": { "type": "string", "description": "Short name for a reader." },
            "description": { "type": "string", "description": "One line saying what the instrument simulates." },
            "encoding_type": {
              "type": "string",
              "description": "SensorThings encodingType of the instrument's metadata. The metadata itself is composed from the noise model, so an instrument cannot describe a noise it does not add."
            }
          }
        },
        "noise": {
          "title": "Instrument noise",
          "description": "Drawn from the seeded generator for this component's stream, so the observations are reproducible from the run manifest and two runs from one root seed produce identical stores.",
          "type": "object",
          "required": ["distribution", "standard_deviation"],
          "additionalProperties": false,
          "properties": {
            "distribution": {
              "type": "string",
              "enum": ["gaussian", "none"],
              "description": "gaussian adds a seeded draw; none publishes the field value unchanged, which is what a test that wants an exact comparison asks for."
            },
            "standard_deviation": {
              "type": "number",
              "minimum": 0,
              "description": "One standard deviation, in the datastream's unit. Zero is the same as no noise and is stated rather than implied."
            }
          }
        }
      }
    },
    "observed_property": {
      "title": "Observed property configuration",
      "description": "The quantity, named as both the query layer and the coverage store name it. The measured spelling is one of exactly three; there is no fourth, by ADR-0005.",
      "type": "object",
      "required": ["measured", "id", "name", "definition", "description"],
      "additionalProperties": false,
      "properties": {
        "measured": {
          "$ref": "https://schemas.harness.invalid/observation.schema.json#/$defs/observed_property",
          "description": "Which of the three quantities this series carries, as it appears on the wire."
        },
        "id": {
          "type": "string",
          "pattern": "^[a-z][a-z0-9_]*$",
          "description": "The CF-style name, for example sea_water_temperature."
        },
        "name": { "type": "string", "description": "The quantity in words." },
        "definition": { "type": "string", "description": "What the name means, as a definition a consumer can resolve." },
        "description": { "type": "string", "description": "One line for a reader." }
      }
    }
  }
}
